<?xml version="1.0" encoding="UTF-8"?>
<template xmlns:xsi="http://www.w3.org/2001/XMLSchema-instance"
	xsi:noNamespaceSchemaLocation="https://xml.sigsiu.net/SobiPro/template.xsd">
	<name>Default SobiPro Template</name>
	<id>default_template</id>
	<authorName>Sigrid Suski and Radek Suski</authorName>
	<authorEmail>sobi[at]sigsiu.net</authorEmail>
	<authorUrl>http://www.Sigsiu.NET</authorUrl>
	<copyright>Copyright (C) 2006-2013 Sigsiu.NET GmbH</copyright>
	<license>GNU General Public License</license>
	<creationDate>2013-01-01</creationDate>
	<version>2.0</version>
	<description>
		Default SobiPro Template for SobiPro 1.1
    </description>
	<files>
		<file path="category/view.xsl">
			Default category view template with top menu, navigation, entries and categories.
		</file>
		<file path="common/alphamenu.xsl">
			Template for the alpha menu. Fields chooser and calls the alpha index (letters) template.
		</file>
        <file path="common/alphindex.xsl">
            Template for the alpha index (letters) only.
        </file>
		<file path="common/catchooser.xsl">
			Sub-Template for the category chooser for the edit entry form.
		</file>
        <file path="common/categories.xsl">
            Template for the categories list (categoriesLoop). Calls the template for a single category.
        </file>
		<file path="common/category.xsl">
			Template for a single category in the categories list.
		</file>
		<file path="common/entries.xsl">
			Template to display all entries (entriesLoop) within a category or the search function. Build the structure of all entries and calls the "vCard" template while displaying single entry.
		</file>
		<file path="common/manage.xsl">
			Displays the managing functions like edit entry, approve aso, within an entry.
		</file>
        <file path="common/messages.xsl">
            Displays the message bar.
        </file>
		<file path="common/navigation.xsl">
			Template for the site navigation.
		</file>
		<file path="common/topmenu.xsl">
			Template for the top menu.
		</file>
		<file path="common/vcard.xsl">
			Template to display single entry within a category or the search function.
		</file>
		<file path="css/default.css">
			Default CSS file.
		</file>
        <file path="css/default.less">
            Less file for the default CSS file in case you prefer using Less.
        </file>
		<file path="css/edit.css">
			CSS file with extra styles for the add/edit entry page.
		</file>
        <file path="css/edit.less">
            Less file for the add/edit entry CSS file in case you prefer using Less.
        </file>
		<file path="css/search.css">
			CSS file with extra styles for the search function.
		</file>
        <file path="css/search.less">
            Less file for the search CSS file in case you prefer using Less.
        </file>
		<file path="entry/details.xsl">
			Template for the entry details view page.
		</file>
		<file path="entry/edit.xsl">
			Template for the add/edit entry page.
		</file>
		<file path="feeds/rss.xsl">
			Template for Atom/RSS feeds.
		</file>
		<file path="js/alpha.js">
			JavaScript functions for the alpha menu.
		</file>
		<file path="js/autosuggest.js">
            JavaScript functions for the auto-suggest feature used in search and add/edit entry page.
		</file>
		<file path="js/search.js">
			JavaScript functions for the search page.
		</file>
		<file path="listing/alpha.xsl">
			Alpha listings template.
		</file>
		<file path="payment/payment.xsl">
			Payment page after an entry has been added.
		</file>
        <file path="payment/list.xsl">
            List of payments on the payment page.
        </file>
		<file path="payment/submit.xsl">
			Template for the preview of the payment.
		</file>
		<file path="search/view.xsl">
			Template for the search function.
		</file>
		<file path="section/view.xsl">
			Template for the section main view.
		</file>
		<file path="template.php">
			PHP file with additional functions to use within templates.
		</file>
        <file path="translation.xml">
            Translation file for texts in templates.
        </file>
        <file path="config.ini">
            Main template configuration file.
        </file>
	</files>
</template>
