<?xml version="1.0" encoding="UTF-8"?>
<template xmlns:xsi="http://www.w3.org/2001/XMLSchema-instance" xsi:noNamespaceSchemaLocation="https://xml.sigsiu.net/SobiPro/template.xsd">
	<name>B3-Default Template V4</name>
	<id>b3-default3</id>
	<authorName>Sigrid Suski and Radek Suski</authorName>
	<authorEmail>sobi[at]sigsiu.net</authorEmail>
	<authorUrl>http://www.Sigsiu.NET</authorUrl>
	<copyright>Copyright (C) 2006-2017 Sigsiu.NET GmbH</copyright>
	<license>GNU General Public License</license>
	<creationDate>2017-06-22</creationDate>
	<version>4.0</version>
	<description>Default Template for SobiPro 1.4+ with Bootstrap 3 support.
	This template makes use of Bootstrap 3 and Font Awesome 3 elements and styles.</description>
	<files>
		<file path="category/view.xsl">
			Default category view template with top menu, navigation, entries and categories.
		</file>
		<file path="common/alphamenu.xsl">
			Template for the alpha menu. Fields chooser and calls the alpha index (letters) template.
		</file>
        <file path="common/alphaindex.xsl">
            Template for the alpha index (letters) only.
        </file>
        <file path="common/categories.xsl">
            Template for the categories list (categoriesLoop). Calls the template for a single category.
        </file>
		<file path="common/category.xsl">
			Template for a single category in the categories list.
		</file>
		<file path="common/editfields.xsl">
			Template to output one field in entry form. Called from default loop in edit.xsl.
		</file>
		<file path="common/entries.xsl">
			Template to display all entries (entriesLoop) within a category or the search function. Build the structure of all entries and calls the "vCard" template while displaying single entry.
		</file>
		<file path="common/font.xsl">
			Template to load Google fonts.
		</file>
		<file path="common/manage.xsl">
			Displays the managing functions like edit entry, approve aso, within an entry.
		</file>
        <file path="common/messages.xsl">
            Displays the message bar.
        </file>
		<file path="common/navigation.xsl">
			Template for the site navigation.
		</file>
		<file path="common/searchfields.xsl">
			Template to output one field in the search. Called from default loop.
		</file>
		<file path="common/showfields.xsl">
			Template to output one field in vCard and details view. Called from default loop.
		</file>
		<file path="common/topmenu.xsl">
			Template for the top menu.
		</file>
		<file path="common/vcard.xsl">
			Template to display single entry within a category, any listing view or the search function.
		</file>
		<file path="css/tmpl/jbootstrap.css">
			CSS classes to restore changes made by Joomla Bootstrap 2 template.
		</file>
		<file path="css/tmpl/joostrap.css">
			CSS classes to restore changes made by Joostrap templates.
		</file>
		<file path="css/default.css">
			Default CSS file. Your own CSS changes goes in here.
		</file>
        <file path="css/default.less">
            LESS file for the default CSS file. Your own CSS changes goes in here.
        </file>
        <file path="css/theme.css">
            The theme CSS file. Automatically generated!
        </file>
        <file path="css/theme.less">
            LESS file for the theme CSS file.
        </file>
		<file path="entry/details.xsl">
			Template for the entry details view page.
		</file>
		<file path="entry/details.ini">
			Configuration file to load JS files in details view.
		</file>
		<file path="entry/edit.xsl">
			Template for the add/edit entry page.
		</file>
		<file path="entry/edit.ini">
			Configuration file to load JS files in entry form.
		</file>
		<file path="entry/edit.json">
			Configuration file for the entry form. Automatically generated!
		</file>
		<file path="feeds/rss.xsl">
			Template for Atom/RSS feeds.
		</file>
		<file path="feeds/rss.ini">
			Configuration file for RSS feeds.
		</file>
		<file path="feeds/rss.json">
			Configuration file for RSS feeds. Automatically generated!
		</file>
		<file path="js/alpha.js">
			JavaScript functions for the alpha menu.
		</file>
		<file path="js/autosuggest.js">
            JavaScript functions for the auto-suggest feature used in search and entry form.
		</file>
		<file path="js/details.js">
			JavaScript functions for the details view.
		</file>
		<file path="js/navigation.js">
			JavaScript functions for AJAX navigation.
		</file>
		<file path="js/search.js">
			JavaScript functions for the search form.
		</file>
		<file path="listing/alpha.xsl">
			Alpha listings template.
		</file>
		<file path="listing/date.xsl">
			Date listings template.
		</file>
		<file path="listing/user.xsl">
			User listings template.
		</file>
		<file path="payment/list.xsl">
			List of payments on the payment page.
		</file>
		<file path="payment/payment.xsl">
			Payment page after an entry has been added.
		</file>
		<file path="payment/submit.xsl">
			Template for the preview of the payment.
		</file>
		<file path="search/view.xsl">
			Template for the search form.
		</file>
		<file path="search/search.ini">
			Configuration file to load JS files in search form.
		</file>
		<file path="section/view.xsl">
			Template for the section main view.
		</file>
		<file path="section/ajax.xsl">
			Template for AJAX navigation.
		</file>
		<file path="section/ajax.ini">
			Configuration file for AJAX navigation.
		</file>
        <file path="themes/cornfield.less">
            Cornfield color theme (yellow/orange/brown).
        </file>
        <file path="themes/cornflower.less">
            Cornflower color theme (blue).
        </file>
        <file path="themes/malva.less">
            Malva color theme (violett).
        </file>
        <file path="themes/meadow.less">
            Meadow color theme (green).
        </file>
        <file path="themes/poppyseed.less">
            Poppyseed color theme (shades of grey).
        </file>
        <file path="themes/roses.less">
            Roses color theme (red/rose).
        </file>
        <file path="themes/sobipro.less">
            SobiPro color theme (SobiPro colors; default).
        </file>
		<file path="themes/terra.less">
			Terra color theme (brown).
		</file>
		<file path="themes/waterfall.less">
			Waterfall color theme (aquamarine).
		</file>
		<file path="template.php">
			PHP file with additional functions to use within templates.
		</file>
        <file path="translation.xml">
            Translation file for texts in templates.
        </file>
        <file path="config.ini">
            Main template configuration file.
        </file>
        <file path="config.xml">
            Template settings file.
        </file>
		<file path="config.json">
			Template settings configuration file. Automatically generated!
		</file>
	</files>
</template>
